{
  "id": "4at-delirium-screen",
  "title": "4AT delirium screen",
  "subtitle": "Delirium and cognitive impairment screen",
  "version": "0.2.1",
  "minimumAppVersion": "0.18.0",
  "status": "active",
  "mode": "calculator",
  "typeLabel": "Delirium and cognitive impairment screening",
  "summary": "The 4AT screens for possible delirium and cognitive impairment.",
  "population": [
    "Adults where delirium or cognitive impairment is suspected."
  ],
  "exclusions": [],
  "criteria": [
    {
      "id": "alertness",
      "label": "1. Alertness",
      "description": "",
      "inputType": "choice",
      "unit": "",
      "scoreWhenTrue": 0,
      "rules": [],
      "choices": [
        {
          "id": "normal-fully-alert",
          "label": "Normal; fully alert",
          "score": 0
        },
        {
          "id": "clearly-abnormal-markedly-drowsy-or-agitated",
          "label": "Clearly abnormal: markedly drowsy or agitated",
          "score": 4
        }
      ]
    },
    {
      "id": "amt4",
      "label": "2. AMT4",
      "description": "Ask the patient their age, date of birth, place (hospital/building), and the current year (0 for no mistakes, 1 for 1 mistake, 2 for 2+ mistakes or untestable)",
      "inputType": "choice",
      "unit": "",
      "scoreWhenTrue": 0,
      "rules": [],
      "choices": [
        {
          "id": "no-mistakes",
          "label": "No mistakes",
          "score": 0
        },
        {
          "id": "one-mistake",
          "label": "One mistake",
          "score": 1
        },
        {
          "id": "two-or-more-mistakes-or-untestable",
          "label": "Two or more mistakes or untestable",
          "score": 2
        }
      ]
    },
    {
      "id": "attention",
      "label": "3. Attention: months backwards",
      "description": " Ask the patient to list the months of the year in reverse order starting from December (0 for 7+ correct, 1 for <7 correct/refused, 2 for untestable)",
      "inputType": "choice",
      "unit": "",
      "scoreWhenTrue": 0,
      "rules": [],
      "choices": [
        {
          "id": "seven-months-or-more-correctly",
          "label": "Seven months or more correctly",
          "score": 0
        },
        {
          "id": "starts-but-scores-fewer-than-seven-months-or-refuses",
          "label": "Starts but scores fewer than seven months or refuses",
          "score": 1
        },
        {
          "id": "untestable",
          "label": "Untestable",
          "score": 2
        }
      ]
    },
    {
      "id": "acute-change",
      "label": "4. Acute change or fluctuating course",
      "description": "Check medical notes or talk to staff/carers to see if there is a distinct mental status change or fluctuation over the past two weeks that persists in the last 24 hours",
      "inputType": "choice",
      "unit": "",
      "scoreWhenTrue": 0,
      "rules": [],
      "choices": [
        {
          "id": "no",
          "label": "No",
          "score": 0
        },
        {
          "id": "yes-change-in-cognition-alertness-or-mental-function-within-about-2-weeks-and-still-evident-in-the-last-24-hours",
          "label": "Yes: change in cognition, alertness or mental function within about 2 weeks and still evident in the last 24 hours",
          "score": 4
        }
      ]
    }
  ],
  "results": [
    {
      "id": "zero",
      "minimumScore": 0,
      "maximumScore": 0,
      "label": "Delirium less likely",
      "interpretation": [
        "Delirium or severe cognitive impairment is less likely, but not excluded."
      ],
      "actions": [
        "Continue baseline clinical assessment; repeat 4AT if clinical change occurs"
      ]
    },
    {
      "id": "one-three",
      "minimumScore": 1,
      "maximumScore": 3,
      "label": "Possible cognitive impairment",
      "interpretation": [
        "Possible cognitive impairment; delirium is not excluded."
      ],
      "actions": [
        "Administer formal cognitive assessment tool (Montreal Cognitive Assessment, Mini-Cog, or equivalent)",
        "Review all medications for cognitive/CNS effects; document findings and discuss deprescribing where appropriate",
        "Order initial investigations: blood glucose, oxygen saturation, temperature, vital signs; consider urea, electrolytes, full blood count, blood cultures if sepsis suspected"
      ]
    },
    {
      "id": "four-plus",
      "minimumScore": 4,
      "maximumScore": 12,
      "label": "Possible delirium",
      "interpretation": [
        "Possible delirium, with or without cognitive impairment. Assess cause urgently."
      ],
      "actions": [
        "Immediate investigation: blood glucose, oxygen saturation, temperature, vital signs, urea and electrolytes, full blood count, blood cultures",
        "Assess specifically for hypoglycaemia, hypoxia, stroke (focal neuro signs), sepsis (temperature, white cell count, CRP), head injury, acute intoxication, drug toxicity, or withdrawal",
        "Initiate specific management based on identified cause (e.g., glucose correction, oxygen delivery, antibiotics if septic, antiepileptic if seizures)",
        "Continuous monitoring of mental status; document fluctuations and triggers"
      ]
    }
  ],
  "overrides": [
    "Hypoglycaemia, hypoxia, stroke, sepsis, head injury, drug toxicity, withdrawal and other causes of altered mental state require separate assessment."
  ],
  "limitations": [
    "A 4AT score is not a capacity assessment."
  ],
  "calculationStrategy": "sum",
  "referenceIds": [],
  "clinicalValidation": {
    "validated": true,
    "reviewedBy": "Sean McGrory",
    "reviewedOn": "2026-09-19",
    "reviewerRole": "tAPUC",
    "reviewNotes": "Review completed. No additional review comments recorded.",
    "nextReviewDue": "2028-09-19"
  },
  "evaluation": {
    "kind": "sum",
    "scoreCriteria": null,
    "requiredTrue": [],
    "failureScore": null,
    "failureResultId": null,
    "groups": [],
    "decisionRules": []
  },
  "parityCases": [
    {
      "id": "result-zero",
      "description": "Executable case for result band: Delirium less likely.",
      "inputs": {
        "alertness": "normal-fully-alert",
        "amt4": "no-mistakes",
        "attention": "seven-months-or-more-correctly",
        "acute-change": "no"
      },
      "expectedScore": 0,
      "expectedResultId": "zero"
    },
    {
      "id": "result-one-three",
      "description": "Executable case for result band: Possible cognitive impairment.",
      "inputs": {
        "alertness": "normal-fully-alert",
        "amt4": "no-mistakes",
        "attention": "starts-but-scores-fewer-than-seven-months-or-refuses",
        "acute-change": "no"
      },
      "expectedScore": 1,
      "expectedResultId": "one-three"
    },
    {
      "id": "result-four-plus",
      "description": "Executable case for result band: Possible delirium.",
      "inputs": {
        "alertness": "normal-fully-alert",
        "amt4": "no-mistakes",
        "attention": "seven-months-or-more-correctly",
        "acute-change": "yes-change-in-cognition-alertness-or-mental-function-within-about-2-weeks-and-still-evident-in-the-last-24-hours"
      },
      "expectedScore": 4,
      "expectedResultId": "four-plus"
    },
    {
      "id": "maximum-score",
      "description": "All criteria set to their highest scoring values.",
      "inputs": {
        "alertness": "clearly-abnormal-markedly-drowsy-or-agitated",
        "amt4": "two-or-more-mistakes-or-untestable",
        "attention": "untestable",
        "acute-change": "yes-change-in-cognition-alertness-or-mental-function-within-about-2-weeks-and-still-evident-in-the-last-24-hours"
      },
      "expectedScore": 12,
      "expectedResultId": "four-plus"
    }
  ],
  "attachments": [],
  "prominentResources": []
}
